{
  "schema_version": 1,
  "phase": 9,
  "project_root": "/Users/albertobecerra/Tools/oss-prep",
  "prep_branch": "oss-prep/ready",
  "project_profile": {
    "language": "Markdown, Shell, JSON",
    "framework": "Not detected",
    "package_manager": "Not detected",
    "build_system": "Not detected",
    "test_framework": "Not detected"
  },
  "findings": {
    "total": 14,
    "critical": 0,
    "high": 4,
    "medium": 3,
    "low": 7
  },
  "phases_completed": [0, 1, 2, 3, 4, 5, 6, 7, 8, 9],
  "history_flattened": true,
  "phase_findings": {
    "0": { "total": 0, "critical": 0, "high": 0, "medium": 0, "low": 0, "status": "completed" },
    "1": { "total": 4, "critical": 0, "high": 0, "medium": 0, "low": 4, "status": "completed" },
    "2": { "total": 1, "critical": 0, "high": 0, "medium": 1, "low": 0, "status": "completed" },
    "3": { "total": 0, "critical": 0, "high": 0, "medium": 0, "low": 0, "status": "completed" },
    "4": { "total": 2, "critical": 0, "high": 0, "medium": 0, "low": 2, "status": "completed" },
    "5": { "total": 0, "critical": 0, "high": 0, "medium": 0, "low": 0, "status": "completed" },
    "6": { "total": 2, "critical": 0, "high": 0, "medium": 1, "low": 1, "status": "completed" },
    "7": { "total": 5, "critical": 0, "high": 4, "medium": 1, "low": 0, "status": "completed" },
    "8": { "total": 0, "critical": 0, "high": 0, "medium": 0, "low": 0, "status": "completed" }
  },
  "license_choice": "MIT",
  "readiness_rating": "Ready with Caveats",
  "started_at": "2026-02-13T00:00:00Z",
  "phase_failures": {
    "5": { "attempt": 2, "error": "Content filtering policy blocked sub-agent output twice", "fallback": "main_context" }
  }
}
